{"domain":"formal_domain:bitmesh_composed_board_material:v0","position_constraints":{"castling_rights":"none","en_passant":"none","encoding":"fen","legality_contract":"board_syntax_only"},"provenance":{"source_artifact":"data/discovery/wave_69/reference-atlas.jsonl.gz","source_commit":"1434fca1fc04d97798ec1b820c56f52f8014ccc7","source_row_id":"astralbase-w52-mixed-hook-signature-target-exact-046"},"ranker_view":{"identity_contract":"thermograph_structural_tree_v1","identity_sha256":"2ee555faee667f194ec049d392780afabc3b90d960431f4ad84e5682b2482e0d","kind":"bounded_structural_game_form","value_class":"game_tree","value_rule":"component_depth2_local_move_game_v0"},"schema_version":"partizan.discovery_target.v0.1","search_limits":{"max_pool_size":4096,"max_recursive_nodes_per_candidate":100000,"max_verifier_calls":4096},"target":{"equality_scope":"structural_tree_identity_only_not_arbitrary_cgt_equivalence","identity_contract":"thermograph_structural_tree_v1","identity_sha256":"2ee555faee667f194ec049d392780afabc3b90d960431f4ad84e5682b2482e0d","kind":"bounded_structural_game_form","value_class":"game_tree","value_rule":"component_depth2_local_move_game_v0"},"target_id":"target-sha256:052f4191fdcbb6fa45716b97cc85949f8c2287c75d532893084955ab7c666122"}
