{"domain":"formal_domain:bitmesh_composed_board_material:v0","position_constraints":{"castling_rights":"none","en_passant":"none","encoding":"fen","legality_contract":"board_syntax_only"},"provenance":{"source_artifact":"docs/signature_target_mixed_hook_exact_wave_55_rpf36.jsonl","source_commit":"5f999e72f68510b800abc462dabc06785c6a79a6","source_row_id":"astralbase-w52-mixed-hook-signature-target-exact-012"},"ranker_view":{"identity_contract":"thermograph_structural_tree_v1","identity_sha256":"ea8ae7a2a43f02df9cf4fabf8034f641b4c5e0cfc584ce5be8aecde2401a5d40","kind":"bounded_structural_game_form","value_class":"game_tree","value_rule":"component_depth2_local_move_game_v0"},"schema_version":"partizan.discovery_target.v0.1","search_limits":{"max_pool_size":4,"max_recursive_nodes_per_candidate":100000,"max_verifier_calls":4},"target":{"equality_scope":"structural_tree_identity_only_not_arbitrary_cgt_equivalence","identity_contract":"thermograph_structural_tree_v1","identity_sha256":"ea8ae7a2a43f02df9cf4fabf8034f641b4c5e0cfc584ce5be8aecde2401a5d40","kind":"bounded_structural_game_form","value_class":"game_tree","value_rule":"component_depth2_local_move_game_v0"},"target_id":"target-sha256:c22a73801f2e855ec21de33b9e10c3023683b196bdcc05566eb8bf4a4feb9fe8"}
